BOM object that has attributes for global variables and functions,window
BOM object that represents browser viewport,window
BOM,browser object model
DOM node that is root of all other nodes,document
DOM,document object model
can refer to global object or current object,this
controls whether entire document is editable,designMode
declare nonglobal,var
document method to make new element node,createElement
element method to add subelement,appendChild
keyword for alternate condition,else
keyword for conditional loop,while
keyword for conditional,if
keyword for numbered loop,for
keyword for subroutine or method,function
keyword to exit from case or loop,break
keyword to skip to next iteration of loop,continue
keyword to terminate function and yield function value,return
keywords for conditionl loop that executes at least once,do...while
keywords for loop that enumerates object properties,for...in
method to exchange substring for new substring,replace
operator to check for parent constructor.prototype,instanceof
operator to create object instance,new
property for number of chars in string or elements in array,length
statement to evaluate expression for selecting case block,switch
statement to identify code block within switch,case
value of negative boolean,false
value of positive boolean,true
